{
  "companyId": "lloyds-banking-group-plc",
  "companyName": "Lloyds Banking Group plc",
  "section1": {
    "ultimateParentName": "Lloyds Banking Group plc",
    "registeredOfficeCountry": "GB",
    "financialYearStart": "2023-01-01",
    "financialYearEnd": "2023-12-31",
    "reportingCurrency": "GBP",
    "taxReportingBasis": "consolidated",
    "basisDescription": "The Group's country-by-country disclosures have been prepared on the basis of the geographical location of the business unit booking the transaction. Overseas branches of UK companies are shown as separate business units for the purposes of this report. Income and expenses between business units in the same jurisdiction have been eliminated. Transactions between business units in different geographical locations have not been eliminated."
  },
  "section2": [
    {
      "taxJurisdiction": "United Kingdom",
      "countryCode": "GB",
      "jurisdictionType": "eea_state",
      "revenueTotal": 17942000000,
      "revenueFromUnrelatedParties": null,
      "revenueFromRelatedParties": null,
      "profitOrLossBeforeIncomeTax": 7070000000,
      "incomeTaxPaidCashBasis": -1360000000,
      "incomeTaxAccruedCurrentYear": null,
      "accumulatedEarnings": null,
      "numberOfEmployees": 60164
    },
    {
      "taxJurisdiction": "Channel Islands and Isle of Man",
      "countryCode": "OT",
      "jurisdictionType": "aggregated_other",
      "revenueTotal": 196000000,
      "revenueFromUnrelatedParties": null,
      "revenueFromRelatedParties": null,
      "profitOrLossBeforeIncomeTax": 129000000,
      "incomeTaxPaidCashBasis": -7000000,
      "incomeTaxAccruedCurrentYear": null,
      "accumulatedEarnings": null,
      "numberOfEmployees": 528
    },
    {
      "taxJurisdiction": "USA",
      "countryCode": "US",
      "jurisdictionType": "aggregated_other",
      "revenueTotal": 216000000,
      "revenueFromUnrelatedParties": null,
      "revenueFromRelatedParties": null,
      "profitOrLossBeforeIncomeTax": 155000000,
      "incomeTaxPaidCashBasis": -33000000,
      "incomeTaxAccruedCurrentYear": null,
      "accumulatedEarnings": null,
      "numberOfEmployees": 231
    },
    {
      "taxJurisdiction": "Germany",
      "countryCode": "DE",
      "jurisdictionType": "eu_member_state",
      "revenueTotal": 41000000,
      "revenueFromUnrelatedParties": null,
      "revenueFromRelatedParties": null,
      "profitOrLossBeforeIncomeTax": -31000000,
      "incomeTaxPaidCashBasis": -1000000,
      "incomeTaxAccruedCurrentYear": null,
      "accumulatedEarnings": null,
      "numberOfEmployees": 337
    },
    {
      "taxJurisdiction": "Netherlands",
      "countryCode": "NL",
      "jurisdictionType": "eu_member_state",
      "revenueTotal": 227000000,
      "revenueFromUnrelatedParties": null,
      "revenueFromRelatedParties": null,
      "profitOrLossBeforeIncomeTax": 183000000,
      "incomeTaxPaidCashBasis": -24000000,
      "incomeTaxAccruedCurrentYear": null,
      "accumulatedEarnings": null,
      "numberOfEmployees": 167
    },
    {
      "taxJurisdiction": "Other",
      "countryCode": "OT",
      "jurisdictionType": "aggregated_other",
      "revenueTotal": 7000000,
      "revenueFromUnrelatedParties": null,
      "revenueFromRelatedParties": null,
      "profitOrLossBeforeIncomeTax": -3000000,
      "incomeTaxPaidCashBasis": -12000000,
      "incomeTaxAccruedCurrentYear": null,
      "accumulatedEarnings": null,
      "numberOfEmployees": 38
    }
  ],
  "section3": [
    {
      "taxJurisdiction": "United Kingdom",
      "countryCode": "GB",
      "subsidiaries": [
        {
          "name": "Bank of Scotland plc",
          "activitiesNature": [
            "Banking and financial services"
          ]
        },
        {
          "name": "HBOS plc",
          "activitiesNature": [
            "Holding company"
          ]
        },
        {
          "name": "Lloyds Bank plc",
          "activitiesNature": [
            "Banking and financial services"
          ]
        },
        {
          "name": "Lloyds Bank Corporate Markets plc",
          "activitiesNature": [
            "Banking and financial services"
          ]
        },
        {
          "name": "Scottish Widows Limited",
          "activitiesNature": [
            "Life assurance"
          ]
        }
      ]
    },
    {
      "taxJurisdiction": "Channel Islands and Isle of Man",
      "countryCode": "OT",
      "subsidiaries": [
        {
          "name": "Lloyds Bank Corporate Markets plc \u00e2\u20ac\u201c branch",
          "activitiesNature": [
            "Banking and financial services"
          ]
        },
        {
          "name": "Black Horse Offshore Limited",
          "activitiesNature": [
            "Banking and financial services"
          ]
        },
        {
          "name": "Lloyds Bank International Limited",
          "activitiesNature": [
            "Banking and financial services"
          ]
        }
      ]
    },
    {
      "taxJurisdiction": "USA",
      "countryCode": "US",
      "subsidiaries": [
        {
          "name": "Lloyds Bank Corporate Markets plc \u00e2\u20ac\u201c branch",
          "activitiesNature": [
            "Banking and financial services"
          ]
        },
        {
          "name": "Lloyds America Securities Corporation",
          "activitiesNature": [
            "Banking and financial services"
          ]
        }
      ]
    },
    {
      "taxJurisdiction": "Germany",
      "countryCode": "DE",
      "subsidiaries": [
        {
          "name": "Bank of Scotland plc \u00e2\u20ac\u201c branch",
          "activitiesNature": [
            "Banking and financial services"
          ]
        },
        {
          "name": "Lloyds Bank plc \u00e2\u20ac\u201c branch",
          "activitiesNature": [
            "Banking and financial services"
          ]
        },
        {
          "name": "Lloyds Bank GmbH",
          "activitiesNature": [
            "Banking and financial services"
          ]
        },
        {
          "name": "Lloyds Bank Corporate Markets Wertpapierhandelsbank GmbH",
          "activitiesNature": [
            "Banking and financial services"
          ]
        }
      ]
    },
    {
      "taxJurisdiction": "Netherlands",
      "countryCode": "NL",
      "subsidiaries": [
        {
          "name": "Lloyds Bank GmbH \u00e2\u20ac\u201c branch",
          "activitiesNature": [
            "Banking and financial services"
          ]
        },
        {
          "name": "Bank of Scotland plc \u00e2\u20ac\u201c branch",
          "activitiesNature": [
            "Banking and financial services"
          ]
        }
      ]
    }
  ],
  "section4": {
    "hasOmittedInformation": false,
    "omissionDetails": null,
    "omissionExpiryYear": null
  },
  "section5": {
    "hasMaterialDiscrepancies": false,
    "discrepancyExplanation": null
  },
  "extractionMetadata": {
    "sourceUrl": "https://www.lloydsbankinggroup.com/assets/pdfs/investors/financial-performance/lloyds-banking-group-plc/2023/q4/2023-lbg-crdiv-country-analysis.pdf",
    "sourceType": "pdf",
    "extractedAt": "2026-05-04T12:22:36.919Z",
    "extractionModel": "claude-sonnet-4-20250514",
    "confidenceNotes": null,
    "manualReviewStatus": "pending"
  }
}