{
  "companyId": "lloyds-banking-group-plc",
  "companyName": "Lloyds Banking Group plc",
  "section1": {
    "ultimateParentName": "Lloyds Banking Group plc",
    "registeredOfficeCountry": "GB",
    "financialYearStart": "2024-01-01",
    "financialYearEnd": "2024-12-31",
    "reportingCurrency": "GBP",
    "taxReportingBasis": "consolidated",
    "basisDescription": "The Group's country-by-country disclosures have been prepared on the basis of the geographical location of the business unit booking the transaction. Overseas branches of UK companies are shown as separate business units for the purposes of this report."
  },
  "section2": [
    {
      "taxJurisdiction": "United Kingdom",
      "countryCode": "GB",
      "jurisdictionType": "eu_member_state",
      "revenueTotal": 17219000000,
      "revenueFromUnrelatedParties": null,
      "revenueFromRelatedParties": null,
      "profitOrLossBeforeIncomeTax": 5482000000,
      "incomeTaxPaidCashBasis": -242000000,
      "incomeTaxAccruedCurrentYear": null,
      "accumulatedEarnings": null,
      "numberOfEmployees": 59490
    },
    {
      "taxJurisdiction": "Channel Islands and Isle of Man",
      "countryCode": "IM",
      "jurisdictionType": "grey_listed_jurisdiction",
      "revenueTotal": 155000000,
      "revenueFromUnrelatedParties": null,
      "revenueFromRelatedParties": null,
      "profitOrLossBeforeIncomeTax": 94000000,
      "incomeTaxPaidCashBasis": -11000000,
      "incomeTaxAccruedCurrentYear": null,
      "accumulatedEarnings": null,
      "numberOfEmployees": 540
    },
    {
      "taxJurisdiction": "United States",
      "countryCode": "US",
      "jurisdictionType": "non_cooperative_jurisdiction",
      "revenueTotal": 287000000,
      "revenueFromUnrelatedParties": null,
      "revenueFromRelatedParties": null,
      "profitOrLossBeforeIncomeTax": 219000000,
      "incomeTaxPaidCashBasis": -52000000,
      "incomeTaxAccruedCurrentYear": null,
      "accumulatedEarnings": null,
      "numberOfEmployees": 215
    },
    {
      "taxJurisdiction": "Germany",
      "countryCode": "DE",
      "jurisdictionType": "eu_member_state",
      "revenueTotal": 133000000,
      "revenueFromUnrelatedParties": null,
      "revenueFromRelatedParties": null,
      "profitOrLossBeforeIncomeTax": 48000000,
      "incomeTaxPaidCashBasis": -3000000,
      "incomeTaxAccruedCurrentYear": null,
      "accumulatedEarnings": null,
      "numberOfEmployees": 365
    },
    {
      "taxJurisdiction": "Netherlands",
      "countryCode": "NL",
      "jurisdictionType": "eu_member_state",
      "revenueTotal": 139000000,
      "revenueFromUnrelatedParties": null,
      "revenueFromRelatedParties": null,
      "profitOrLossBeforeIncomeTax": 105000000,
      "incomeTaxPaidCashBasis": -24000000,
      "incomeTaxAccruedCurrentYear": null,
      "accumulatedEarnings": null,
      "numberOfEmployees": 185
    },
    {
      "taxJurisdiction": "India",
      "countryCode": "IN",
      "jurisdictionType": "non_cooperative_jurisdiction",
      "revenueTotal": 66000000,
      "revenueFromUnrelatedParties": null,
      "revenueFromRelatedParties": null,
      "profitOrLossBeforeIncomeTax": 13000000,
      "incomeTaxPaidCashBasis": -3000000,
      "incomeTaxAccruedCurrentYear": null,
      "accumulatedEarnings": null,
      "numberOfEmployees": 1078
    },
    {
      "taxJurisdiction": "Other",
      "countryCode": "XX",
      "jurisdictionType": "aggregated_other",
      "revenueTotal": 4000000,
      "revenueFromUnrelatedParties": null,
      "revenueFromRelatedParties": null,
      "profitOrLossBeforeIncomeTax": 10000000,
      "incomeTaxPaidCashBasis": 0,
      "incomeTaxAccruedCurrentYear": null,
      "accumulatedEarnings": null,
      "numberOfEmployees": 15
    }
  ],
  "section3": [
    {
      "taxJurisdiction": "United Kingdom",
      "countryCode": "GB",
      "subsidiaries": [
        {
          "name": "Bank of Scotland plc",
          "activitiesNature": [
            "Banking and financial services"
          ]
        },
        {
          "name": "HBOS plc",
          "activitiesNature": [
            "Holding company"
          ]
        },
        {
          "name": "Lloyds Bank plc",
          "activitiesNature": [
            "Banking and financial services"
          ]
        },
        {
          "name": "Lloyds Bank Corporate Markets plc",
          "activitiesNature": [
            "Banking and financial services"
          ]
        },
        {
          "name": "Scottish Widows Limited",
          "activitiesNature": [
            "Life assurance"
          ]
        }
      ]
    },
    {
      "taxJurisdiction": "Channel Islands and Isle of Man",
      "countryCode": "IM",
      "subsidiaries": [
        {
          "name": "Lloyds Bank Corporate Markets plc – branch",
          "activitiesNature": [
            "Banking and financial services"
          ]
        },
        {
          "name": "Black Horse Offshore Limited",
          "activitiesNature": [
            "Banking and financial services"
          ]
        }
      ]
    },
    {
      "taxJurisdiction": "United States",
      "countryCode": "US",
      "subsidiaries": [
        {
          "name": "Lloyds Bank Corporate Markets plc – branch",
          "activitiesNature": [
            "Banking and financial services"
          ]
        },
        {
          "name": "Lloyds America Securities Corporation",
          "activitiesNature": [
            "Banking and financial services"
          ]
        }
      ]
    },
    {
      "taxJurisdiction": "Germany",
      "countryCode": "DE",
      "subsidiaries": [
        {
          "name": "Lloyds Bank plc – branch",
          "activitiesNature": [
            "Banking and financial services"
          ]
        },
        {
          "name": "Lloyds Bank GmbH",
          "activitiesNature": [
            "Banking and financial services"
          ]
        },
        {
          "name": "Lloyds Bank Corporate Markets Wertpapierhandelsbank GmbH",
          "activitiesNature": [
            "Banking and financial services"
          ]
        }
      ]
    },
    {
      "taxJurisdiction": "Netherlands",
      "countryCode": "NL",
      "subsidiaries": [
        {
          "name": "Lloyds Bank GmbH – branch",
          "activitiesNature": [
            "Banking and financial services"
          ]
        }
      ]
    },
    {
      "taxJurisdiction": "India",
      "countryCode": "IN",
      "subsidiaries": [
        {
          "name": "Lloyds Offshore Global Services Private Limited",
          "activitiesNature": [
            "Software publishing, consultancy and supply"
          ]
        }
      ]
    }
  ],
  "section4": {
    "hasOmittedInformation": false,
    "omissionDetails": null,
    "omissionExpiryYear": null
  },
  "section5": {
    "hasMaterialDiscrepancies": false,
    "discrepancyExplanation": null
  },
  "extractionMetadata": {
    "sourceUrl": "https://www.lloydsbankinggroup.com/assets/pdfs/investors/financial-performance/lloyds-banking-group-plc/2024/q4/2024-lbg-crdiv-country-analysis.pdf",
    "sourceType": "pdf",
    "extractedAt": "2026-05-04T12:17:01.213Z",
    "extractionModel": "claude-sonnet-4-20250514",
    "confidenceNotes": null,
    "manualReviewStatus": "pending"
  }
}