{
  "companyId": "allianz-se",
  "companyName": "Allianz SE",
  "section1": {
    "ultimateParentName": "Allianz SE",
    "registeredOfficeCountry": "DE",
    "financialYearStart": "2019-01-01",
    "financialYearEnd": "2019-12-31",
    "reportingCurrency": "EUR",
    "taxReportingBasis": "consolidated",
    "basisDescription": null
  },
  "section2": [
    {
      "taxJurisdiction": "USA",
      "countryCode": "US",
      "jurisdictionType": "aggregated_other",
      "revenueTotal": null,
      "revenueFromUnrelatedParties": null,
      "revenueFromRelatedParties": null,
      "profitOrLossBeforeIncomeTax": 3060400000,
      "incomeTaxPaidCashBasis": 535200000,
      "incomeTaxAccruedCurrentYear": 432500000,
      "accumulatedEarnings": null,
      "numberOfEmployees": null
    },
    {
      "taxJurisdiction": "Germany",
      "countryCode": "DE",
      "jurisdictionType": "eu_member_state",
      "revenueTotal": null,
      "revenueFromUnrelatedParties": null,
      "revenueFromRelatedParties": null,
      "profitOrLossBeforeIncomeTax": 1743600000,
      "incomeTaxPaidCashBasis": 81900000,
      "incomeTaxAccruedCurrentYear": 836700000,
      "accumulatedEarnings": null,
      "numberOfEmployees": null
    },
    {
      "taxJurisdiction": "France",
      "countryCode": "FR",
      "jurisdictionType": "eu_member_state",
      "revenueTotal": null,
      "revenueFromUnrelatedParties": null,
      "revenueFromRelatedParties": null,
      "profitOrLossBeforeIncomeTax": 1217200000,
      "incomeTaxPaidCashBasis": 325900000,
      "incomeTaxAccruedCurrentYear": 413400000,
      "accumulatedEarnings": null,
      "numberOfEmployees": null
    },
    {
      "taxJurisdiction": "Italy",
      "countryCode": "IT",
      "jurisdictionType": "eu_member_state",
      "revenueTotal": null,
      "revenueFromUnrelatedParties": null,
      "revenueFromRelatedParties": null,
      "profitOrLossBeforeIncomeTax": 1055400000,
      "incomeTaxPaidCashBasis": 283000000,
      "incomeTaxAccruedCurrentYear": 309400000,
      "accumulatedEarnings": null,
      "numberOfEmployees": null
    },
    {
      "taxJurisdiction": "Switzerland",
      "countryCode": "CH",
      "jurisdictionType": "aggregated_other",
      "revenueTotal": null,
      "revenueFromUnrelatedParties": null,
      "revenueFromRelatedParties": null,
      "profitOrLossBeforeIncomeTax": 533200000,
      "incomeTaxPaidCashBasis": 109700000,
      "incomeTaxAccruedCurrentYear": 8100000,
      "accumulatedEarnings": null,
      "numberOfEmployees": null
    },
    {
      "taxJurisdiction": "Luxembourg",
      "countryCode": "LU",
      "jurisdictionType": "eu_member_state",
      "revenueTotal": null,
      "revenueFromUnrelatedParties": null,
      "revenueFromRelatedParties": null,
      "profitOrLossBeforeIncomeTax": 502500000,
      "incomeTaxPaidCashBasis": 33500000,
      "incomeTaxAccruedCurrentYear": 143300000,
      "accumulatedEarnings": null,
      "numberOfEmployees": null
    },
    {
      "taxJurisdiction": "Australia",
      "countryCode": "AU",
      "jurisdictionType": "aggregated_other",
      "revenueTotal": null,
      "revenueFromUnrelatedParties": null,
      "revenueFromRelatedParties": null,
      "profitOrLossBeforeIncomeTax": 341200000,
      "incomeTaxPaidCashBasis": 142800000,
      "incomeTaxAccruedCurrentYear": 101500000,
      "accumulatedEarnings": null,
      "numberOfEmployees": null
    },
    {
      "taxJurisdiction": "Spain",
      "countryCode": "ES",
      "jurisdictionType": "eu_member_state",
      "revenueTotal": null,
      "revenueFromUnrelatedParties": null,
      "revenueFromRelatedParties": null,
      "profitOrLossBeforeIncomeTax": 286100000,
      "incomeTaxPaidCashBasis": 68500000,
      "incomeTaxAccruedCurrentYear": 64000000,
      "accumulatedEarnings": null,
      "numberOfEmployees": null
    },
    {
      "taxJurisdiction": "Netherlands",
      "countryCode": "NL",
      "jurisdictionType": "eu_member_state",
      "revenueTotal": null,
      "revenueFromUnrelatedParties": null,
      "revenueFromRelatedParties": null,
      "profitOrLossBeforeIncomeTax": 255700000,
      "incomeTaxPaidCashBasis": 41500000,
      "incomeTaxAccruedCurrentYear": 55800000,
      "accumulatedEarnings": null,
      "numberOfEmployees": null
    },
    {
      "taxJurisdiction": "Belgium",
      "countryCode": "BE",
      "jurisdictionType": "eu_member_state",
      "revenueTotal": null,
      "revenueFromUnrelatedParties": null,
      "revenueFromRelatedParties": null,
      "profitOrLossBeforeIncomeTax": 246600000,
      "incomeTaxPaidCashBasis": 39400000,
      "incomeTaxAccruedCurrentYear": 64400000,
      "accumulatedEarnings": null,
      "numberOfEmployees": null
    },
    {
      "taxJurisdiction": "UK",
      "countryCode": "GB",
      "jurisdictionType": "aggregated_other",
      "revenueTotal": null,
      "revenueFromUnrelatedParties": null,
      "revenueFromRelatedParties": null,
      "profitOrLossBeforeIncomeTax": 231900000,
      "incomeTaxPaidCashBasis": 71000000,
      "incomeTaxAccruedCurrentYear": 26100000,
      "accumulatedEarnings": null,
      "numberOfEmployees": null
    },
    {
      "taxJurisdiction": "Turkey",
      "countryCode": "TR",
      "jurisdictionType": "aggregated_other",
      "revenueTotal": null,
      "revenueFromUnrelatedParties": null,
      "revenueFromRelatedParties": null,
      "profitOrLossBeforeIncomeTax": 197700000,
      "incomeTaxPaidCashBasis": 300000,
      "incomeTaxAccruedCurrentYear": 44700000,
      "accumulatedEarnings": null,
      "numberOfEmployees": null
    },
    {
      "taxJurisdiction": "Austria",
      "countryCode": "AT",
      "jurisdictionType": "eu_member_state",
      "revenueTotal": null,
      "revenueFromUnrelatedParties": null,
      "revenueFromRelatedParties": null,
      "profitOrLossBeforeIncomeTax": 148100000,
      "incomeTaxPaidCashBasis": 16900000,
      "incomeTaxAccruedCurrentYear": 36200000,
      "accumulatedEarnings": null,
      "numberOfEmployees": null
    },
    {
      "taxJurisdiction": "Ireland",
      "countryCode": "IE",
      "jurisdictionType": "eu_member_state",
      "revenueTotal": null,
      "revenueFromUnrelatedParties": null,
      "revenueFromRelatedParties": null,
      "profitOrLossBeforeIncomeTax": 142700000,
      "incomeTaxPaidCashBasis": 88200000,
      "incomeTaxAccruedCurrentYear": 27500000,
      "accumulatedEarnings": null,
      "numberOfEmployees": null
    },
    {
      "taxJurisdiction": "Slovakia",
      "countryCode": "SK",
      "jurisdictionType": "eu_member_state",
      "revenueTotal": null,
      "revenueFromUnrelatedParties": null,
      "revenueFromRelatedParties": null,
      "profitOrLossBeforeIncomeTax": 123600000,
      "incomeTaxPaidCashBasis": 34200000,
      "incomeTaxAccruedCurrentYear": 19900000,
      "accumulatedEarnings": null,
      "numberOfEmployees": null
    },
    {
      "taxJurisdiction": "Malaysia",
      "countryCode": "MY",
      "jurisdictionType": "aggregated_other",
      "revenueTotal": null,
      "revenueFromUnrelatedParties": null,
      "revenueFromRelatedParties": null,
      "profitOrLossBeforeIncomeTax": 120500000,
      "incomeTaxPaidCashBasis": 6900000,
      "incomeTaxAccruedCurrentYear": 31100000,
      "accumulatedEarnings": null,
      "numberOfEmployees": null
    },
    {
      "taxJurisdiction": "Taiwan",
      "countryCode": "TW",
      "jurisdictionType": "aggregated_other",
      "revenueTotal": null,
      "revenueFromUnrelatedParties": null,
      "revenueFromRelatedParties": null,
      "profitOrLossBeforeIncomeTax": 113700000,
      "incomeTaxPaidCashBasis": 3500000,
      "incomeTaxAccruedCurrentYear": 23000000,
      "accumulatedEarnings": null,
      "numberOfEmployees": null
    },
    {
      "taxJurisdiction": "Thailand",
      "countryCode": "TH",
      "jurisdictionType": "aggregated_other",
      "revenueTotal": null,
      "revenueFromUnrelatedParties": null,
      "revenueFromRelatedParties": null,
      "profitOrLossBeforeIncomeTax": 112000000,
      "incomeTaxPaidCashBasis": 20300000,
      "incomeTaxAccruedCurrentYear": 29700000,
      "accumulatedEarnings": null,
      "numberOfEmployees": null
    },
    {
      "taxJurisdiction": "Indonesia",
      "countryCode": "ID",
      "jurisdictionType": "aggregated_other",
      "revenueTotal": null,
      "revenueFromUnrelatedParties": null,
      "revenueFromRelatedParties": null,
      "profitOrLossBeforeIncomeTax": 92100000,
      "incomeTaxPaidCashBasis": 17700000,
      "incomeTaxAccruedCurrentYear": 13600000,
      "accumulatedEarnings": null,
      "numberOfEmployees": null
    },
    {
      "taxJurisdiction": "Czech Republic",
      "countryCode": "CZ",
      "jurisdictionType": "eu_member_state",
      "revenueTotal": null,
      "revenueFromUnrelatedParties": null,
      "revenueFromRelatedParties": null,
      "profitOrLossBeforeIncomeTax": 82100000,
      "incomeTaxPaidCashBasis": 23100000,
      "incomeTaxAccruedCurrentYear": 15000000,
      "accumulatedEarnings": null,
      "numberOfEmployees": null
    }
  ],
  "section3": [],
  "section4": {
    "hasOmittedInformation": false,
    "omissionDetails": null,
    "omissionExpiryYear": null
  },
  "section5": {
    "hasMaterialDiscrepancies": false,
    "discrepancyExplanation": null
  },
  "extractionMetadata": {
    "sourceUrl": "C:/Users/aliso/Downloads/Allianz_Tax_Transparency_Report_2019-EN.pdf",
    "sourceType": "pdf",
    "extractedAt": "2026-03-03T15:18:18.666Z",
    "extractionModel": "claude-sonnet-4-20250514",
    "confidenceNotes": null,
    "manualReviewStatus": "pending"
  }
}