{
  "companyId": "deutsche-bank-ag",
  "companyName": "Deutsche Bank AG",
  "section1": {
    "ultimateParentName": "Deutsche Bank Aktiengesellschaft",
    "registeredOfficeCountry": "DE",
    "financialYearStart": "2013-01-01",
    "financialYearEnd": "2013-12-31",
    "reportingCurrency": "EUR",
    "taxReportingBasis": "consolidated",
    "basisDescription": "The disclosure is presented on a consolidated basis as derived from the IFRS Group accounts of Deutsche Bank"
  },
  "section2": [
    {
      "taxJurisdiction": "Australia",
      "countryCode": "AU",
      "jurisdictionType": "aggregated_other",
      "revenueTotal": 414000000,
      "revenueFromUnrelatedParties": null,
      "revenueFromRelatedParties": null,
      "profitOrLossBeforeIncomeTax": null,
      "incomeTaxPaidCashBasis": null,
      "incomeTaxAccruedCurrentYear": null,
      "accumulatedEarnings": null,
      "numberOfEmployees": 593
    },
    {
      "taxJurisdiction": "China",
      "countryCode": "CN",
      "jurisdictionType": "aggregated_other",
      "revenueTotal": 183000000,
      "revenueFromUnrelatedParties": null,
      "revenueFromRelatedParties": null,
      "profitOrLossBeforeIncomeTax": null,
      "incomeTaxPaidCashBasis": null,
      "incomeTaxAccruedCurrentYear": null,
      "accumulatedEarnings": null,
      "numberOfEmployees": 504
    },
    {
      "taxJurisdiction": "Germany",
      "countryCode": "DE",
      "jurisdictionType": "eu_member_state",
      "revenueTotal": 11435000000,
      "revenueFromUnrelatedParties": null,
      "revenueFromRelatedParties": null,
      "profitOrLossBeforeIncomeTax": null,
      "incomeTaxPaidCashBasis": null,
      "incomeTaxAccruedCurrentYear": null,
      "accumulatedEarnings": null,
      "numberOfEmployees": 46377
    },
    {
      "taxJurisdiction": "United Kingdom",
      "countryCode": "GB",
      "jurisdictionType": "aggregated_other",
      "revenueTotal": 4846000000,
      "revenueFromUnrelatedParties": null,
      "revenueFromRelatedParties": null,
      "profitOrLossBeforeIncomeTax": null,
      "incomeTaxPaidCashBasis": null,
      "incomeTaxAccruedCurrentYear": null,
      "accumulatedEarnings": null,
      "numberOfEmployees": 8201
    },
    {
      "taxJurisdiction": "Hong Kong",
      "countryCode": "HK",
      "jurisdictionType": "aggregated_other",
      "revenueTotal": 744000000,
      "revenueFromUnrelatedParties": null,
      "revenueFromRelatedParties": null,
      "profitOrLossBeforeIncomeTax": null,
      "incomeTaxPaidCashBasis": null,
      "incomeTaxAccruedCurrentYear": null,
      "accumulatedEarnings": null,
      "numberOfEmployees": 1248
    },
    {
      "taxJurisdiction": "India",
      "countryCode": "IN",
      "jurisdictionType": "aggregated_other",
      "revenueTotal": 402000000,
      "revenueFromUnrelatedParties": null,
      "revenueFromRelatedParties": null,
      "profitOrLossBeforeIncomeTax": null,
      "incomeTaxPaidCashBasis": null,
      "incomeTaxAccruedCurrentYear": null,
      "accumulatedEarnings": null,
      "numberOfEmployees": 9724
    },
    {
      "taxJurisdiction": "Italy",
      "countryCode": "IT",
      "jurisdictionType": "eu_member_state",
      "revenueTotal": 988000000,
      "revenueFromUnrelatedParties": null,
      "revenueFromRelatedParties": null,
      "profitOrLossBeforeIncomeTax": null,
      "incomeTaxPaidCashBasis": null,
      "incomeTaxAccruedCurrentYear": null,
      "accumulatedEarnings": null,
      "numberOfEmployees": 3981
    },
    {
      "taxJurisdiction": "Japan",
      "countryCode": "JP",
      "jurisdictionType": "aggregated_other",
      "revenueTotal": 714000000,
      "revenueFromUnrelatedParties": null,
      "revenueFromRelatedParties": null,
      "profitOrLossBeforeIncomeTax": null,
      "incomeTaxPaidCashBasis": null,
      "incomeTaxAccruedCurrentYear": null,
      "accumulatedEarnings": null,
      "numberOfEmployees": 714
    },
    {
      "taxJurisdiction": "Luxembourg",
      "countryCode": "LU",
      "jurisdictionType": "eu_member_state",
      "revenueTotal": 1266000000,
      "revenueFromUnrelatedParties": null,
      "revenueFromRelatedParties": null,
      "profitOrLossBeforeIncomeTax": null,
      "incomeTaxPaidCashBasis": null,
      "incomeTaxAccruedCurrentYear": null,
      "accumulatedEarnings": null,
      "numberOfEmployees": 681
    },
    {
      "taxJurisdiction": "Poland",
      "countryCode": "PL",
      "jurisdictionType": "eu_member_state",
      "revenueTotal": 266000000,
      "revenueFromUnrelatedParties": null,
      "revenueFromRelatedParties": null,
      "profitOrLossBeforeIncomeTax": null,
      "incomeTaxPaidCashBasis": null,
      "incomeTaxAccruedCurrentYear": null,
      "accumulatedEarnings": null,
      "numberOfEmployees": 2159
    },
    {
      "taxJurisdiction": "Singapore",
      "countryCode": "SG",
      "jurisdictionType": "aggregated_other",
      "revenueTotal": 975000000,
      "revenueFromUnrelatedParties": null,
      "revenueFromRelatedParties": null,
      "profitOrLossBeforeIncomeTax": null,
      "incomeTaxPaidCashBasis": null,
      "incomeTaxAccruedCurrentYear": null,
      "accumulatedEarnings": null,
      "numberOfEmployees": 1988
    },
    {
      "taxJurisdiction": "Spain",
      "countryCode": "ES",
      "jurisdictionType": "eu_member_state",
      "revenueTotal": 508000000,
      "revenueFromUnrelatedParties": null,
      "revenueFromRelatedParties": null,
      "profitOrLossBeforeIncomeTax": null,
      "incomeTaxPaidCashBasis": null,
      "incomeTaxAccruedCurrentYear": null,
      "accumulatedEarnings": null,
      "numberOfEmployees": 2569
    },
    {
      "taxJurisdiction": "United States",
      "countryCode": "US",
      "jurisdictionType": "aggregated_other",
      "revenueTotal": 7403000000,
      "revenueFromUnrelatedParties": null,
      "revenueFromRelatedParties": null,
      "profitOrLossBeforeIncomeTax": null,
      "incomeTaxPaidCashBasis": null,
      "incomeTaxAccruedCurrentYear": null,
      "accumulatedEarnings": null,
      "numberOfEmployees": 9656
    },
    {
      "taxJurisdiction": "Other locations",
      "countryCode": "XX",
      "jurisdictionType": "aggregated_other",
      "revenueTotal": 1770000000,
      "revenueFromUnrelatedParties": null,
      "revenueFromRelatedParties": null,
      "profitOrLossBeforeIncomeTax": null,
      "incomeTaxPaidCashBasis": null,
      "incomeTaxAccruedCurrentYear": null,
      "accumulatedEarnings": null,
      "numberOfEmployees": 9861
    }
  ],
  "section3": [],
  "section4": {
    "hasOmittedInformation": false,
    "omissionDetails": null,
    "omissionExpiryYear": null
  },
  "section5": {
    "hasMaterialDiscrepancies": false,
    "discrepancyExplanation": null
  },
  "extractionMetadata": {
    "sourceUrl": "https://investor-relations.db.com/files/documents/annual-reports/Deutsche_Bank_CbCR_Disclosure_2013.pdf?language_id=3",
    "sourceType": "pdf",
    "extractedAt": "2026-05-05T15:55:49.973Z",
    "extractionModel": "claude-sonnet-4-20250514",
    "confidenceNotes": null,
    "manualReviewStatus": "pending"
  }
}